{
  "schemaVersion": "mindclade.dev/observability-dashboard/v1alpha1",
  "name": "control-plane",
  "owner": "platform-control",
  "serviceClass": "control-plane",
  "status": "activation-blocked",
  "deployment": {"provider": "google-cloud-monitoring", "terraformModule": "infra/terraform/modules/monitoring", "deployableArtifact": false},
  "requiredEnvironmentInputs": ["emailNotificationChannelResourceNames", "environment", "googleChatNotificationChannelResourceNames", "httpsRunbookUrl", "projectId", "qualificationEvidenceSha256"],
  "refreshInterval": "30s",
  "variables": ["cluster", "environment", "location", "namespace"],
  "panels": [
    {"signal": "control-admission-api-metric-contract-incomplete", "title": "Admission API metric contract", "description": "Exact versioned decision-counter and histogram inventory across every desired API replica.", "metric": "mindclade.control_admission.api_metric_contract_complete", "recordingRule": "mindclade:control_admission_api_metric_contract_complete:min", "unit": "status", "visualization": "scorecard"},
    {"signal": "control-admission-api-target-absent", "title": "Admission API target", "description": "Replica-aware external admission API scrape health aggregated without Pod identity.", "metric": "mindclade.control_admission.api_target_up", "recordingRule": "mindclade:control_admission_api_target_up:min", "unit": "status", "visualization": "scorecard"},
    {"signal": "control-admission-audit-outbox-drift", "title": "Audit and outbox drift", "description": "Bounded divergence counts split only by the fixed reconciliation kind allowlist.", "metric": "mindclade.control_admission.event_drift", "recordingRule": "mindclade:control_admission_event_drift:max", "unit": "count", "visualization": "scorecard"},
    {"signal": "control-admission-backlog-after-two-successful-sweeps", "title": "Consecutive backlogged sweeps", "description": "Successful sweep outcomes retaining backlog, saturated at two for bounded alert state.", "metric": "mindclade.control_admission.consecutive_backlogged_sweeps", "recordingRule": "mindclade:control_admission_consecutive_backlogged_sweeps:max", "unit": "count", "visualization": "scorecard"},
    {"signal": "control-admission-decision-events", "title": "Decision volume", "description": "Five-minute external API decision count used as the latency and availability sample guard.", "metric": "mindclade.control_admission.decision_events_5m", "recordingRule": "mindclade:control_admission_decision_events:increase5m", "unit": "count", "visualization": "line"},
    {"signal": "control-admission-decision-latency-slo-breached", "title": "Decision latency objective", "description": "Exact five-minute fraction of qualified decisions completing within one hundred milliseconds.", "metric": "mindclade.control_admission.decision_latency_objective_ratio_5m", "recordingRule": "mindclade:control_admission_decision_latency_objective:ratio5m", "unit": "ratio", "visualization": "line"},
    {"signal": "control-admission-decision-p99", "title": "Decision latency p99", "description": "Diagnostic five-minute p99 latency split only by the bounded operation allowlist.", "metric": "mindclade.control_admission.decision_p99_seconds", "recordingRule": "mindclade:control_admission_decision_seconds:p99_rate5m", "unit": "seconds", "visualization": "line"},
    {"signal": "control-admission-expiration-backlog", "title": "Expiration backlog", "description": "Replica maximum; 0 through 1000 are exact and 1001 is the explicit at-least-1001 overflow sentinel.", "metric": "mindclade.control_admission.expiration_backlog", "recordingRule": "mindclade:control_admission_expiration_backlog:max", "unit": "count", "visualization": "line"},
    {"signal": "control-admission-expiration-snapshot-stale", "title": "Expiration probe age", "description": "Seconds since the last successful bounded expiration backlog sample.", "metric": "mindclade.control_admission.expiration_snapshot_age_seconds", "recordingRule": "mindclade:control_admission_expiration_snapshot_age_seconds:max", "unit": "seconds", "visualization": "line"},
    {"signal": "control-admission-expired-reservation-age", "title": "Oldest expired reservation", "description": "Age of the oldest reservation that is expired but remains reserved.", "metric": "mindclade.control_admission.oldest_expired_reservation_age_seconds", "recordingRule": "mindclade:control_admission_oldest_expired_reservation_age_seconds:max", "unit": "seconds", "visualization": "line"},
    {"signal": "control-admission-fast-error-budget-burn", "title": "Fast error-budget burn", "description": "Minimum of the five-minute and one-hour burn rates, so both governed windows must breach.", "metric": "mindclade.control_admission.error_budget_fast_burn_pair", "recordingRule": "mindclade:control_admission_error_budget_fast_burn:paired", "unit": "ratio", "visualization": "line"},
    {"signal": "control-admission-lineage-snapshot-stale", "title": "Lineage probe age", "description": "Seconds since the last successful bounded audit and outbox reconciliation sample.", "metric": "mindclade.control_admission.lineage_snapshot_age_seconds", "recordingRule": "mindclade:control_admission_lineage_snapshot_age_seconds:max", "unit": "seconds", "visualization": "line"},
    {"signal": "control-admission-maintenance-metric-contract-incomplete", "title": "Maintenance metric contract", "description": "Exact versioned scalar, drift-kind, and probe inventory across every desired maintenance replica.", "metric": "mindclade.control_admission.maintenance_metric_contract_complete", "recordingRule": "mindclade:control_admission_maintenance_metric_contract_complete:min", "unit": "status", "visualization": "scorecard"},
    {"signal": "control-admission-maintenance-target-absent", "title": "Maintenance target", "description": "Replica-aware maintenance scrape health aggregated without Pod identity.", "metric": "mindclade.control_admission.maintenance_target_up", "recordingRule": "mindclade:control_admission_maintenance_target_up:min", "unit": "status", "visualization": "scorecard"},
    {"signal": "control-admission-slow-error-budget-burn", "title": "Slow error-budget burn", "description": "Minimum of the thirty-minute and six-hour burn rates, so both governed windows must breach.", "metric": "mindclade.control_admission.error_budget_slow_burn_pair", "recordingRule": "mindclade:control_admission_error_budget_slow_burn:paired", "unit": "ratio", "visualization": "line"},
    {"signal": "control-admission-snapshot-success", "title": "Snapshot outcome", "description": "Fail-closed sampler outcome across replicas, split only by expiration and lineage probe.", "metric": "mindclade.control_admission.snapshot_success", "recordingRule": "mindclade:control_admission_snapshot_success:min", "unit": "status", "visualization": "scorecard"},
    {"signal": "control-admission-sweep-stale", "title": "Successful sweep age", "description": "Seconds since the latest successful bounded reservation expiration sweep.", "metric": "mindclade.control_admission.last_successful_sweep_age_seconds", "recordingRule": "mindclade:control_admission_last_successful_sweep_age_seconds:max", "unit": "seconds", "visualization": "line"}
  ],
  "activationPolicy": {"enabledByDefault": false, "requiresConnectedQualification": true, "requiresReviewedThresholds": true}
}
